{
  "$schema": "https://json-schema.org/draft/2020-12/schema",
  "$id": "https://ubm-hyogo.invalid/schema/cloudflare-alerts/policy.schema.json",
  "title": "CloudflareNotificationPolicy",
  "type": "object",
  "required": ["name", "alert_type", "enabled", "conditions", "mechanisms"],
  "properties": {
    "$schema": { "type": "string" },
    "name": { "type": "string", "pattern": "^[a-z0-9-]+$" },
    "description": { "type": "string", "maxLength": 200 },
    "alert_type": { "type": "string", "enum": ["billing_usage_alert"] },
    "enabled": { "type": "boolean" },
    "conditions": {
      "oneOf": [
        {
          "type": "object",
          "required": ["metric", "percentage"],
          "additionalProperties": false,
          "properties": {
            "metric": { "type": "string" },
            "percentage": { "type": "number", "exclusiveMinimum": 0, "exclusiveMaximum": 1 }
          }
        },
        {
          "type": "object",
          "required": ["anyOf"],
          "additionalProperties": false,
          "properties": {
            "anyOf": {
              "type": "array",
              "minItems": 1,
              "items": {
                "type": "object",
                "required": ["metric", "percentage"],
                "additionalProperties": false,
                "properties": {
                  "metric": { "type": "string" },
                  "percentage": { "type": "number", "exclusiveMinimum": 0, "exclusiveMaximum": 1 }
                }
              }
            }
          }
        }
      ]
    },
    "mechanisms": {
      "type": "object",
      "required": ["webhooks"],
      "additionalProperties": false,
      "properties": {
        "webhooks": {
          "type": "array",
          "minItems": 1,
          "items": {
            "type": "object",
            "required": ["name"],
            "additionalProperties": false,
            "properties": { "name": { "type": "string" } }
          }
        }
      }
    }
  },
  "additionalProperties": false
}
